Circleofmamas,circleofmamas,1855831771359080,HEALTH & WELLNESS WEBSITE,US,"Our mission is to spread awareness of Vaccine Injuries. 

",2020-10-30 19:11:58 EDT,N/A,N/A,2020-04-08 15:00:45 EDT,2020-04-08,15:00:45,Native Video,65,35,2,17,7,4,0,0,0,0,share,No,330,96171,0,00:02:47,https://www.facebook.com/circleofmamas/posts/2577669902508593,👏,https://www.facebook.com/melissafloyd11/videos/10220380601878301/,https://www.facebook.com/login/?next=https%3A%2F%2Fwww.facebook.com%2Fmelissafloyd11%2Fvideos%2F10220380601878301%2F,,Melissa,"😱😱😱 Take 3 minutes out of your day to watch this Interview with #PHYSICIAN and #Senator Scott Jensen (Minnesota). 👇👇👇

——————
Reporter: Why would they want to skew the number of deaths due to COVID-19?

Dr. Jensen: Well ... fear is a great way to control people ... Sometimes people‘s ability to think for themselves is paralyzed if they’re frightened enough.
——————

“We’re not going to win this battle by kicking the can down the road [prolonging the inevitable]. At some level, we’re going to win this battle by having enough people immune to it, by getting disease ... and it’s a mild disease in 90% of the people. So the idea of minimizing this wave of the pandemic so the next wave in the fall of the year will be greater, that doesn’t make a ton of sense either.”",,,,2.71
Healthy Holistic Living,healthyholisticliving,134953239880777,HEALTH & WELLNESS WEBSITE,US,"""The greatest discovery of any generation is that human beings can alter their lives by altering the attitudes of their minds.""            ",2014-04-16 16:05:04 EDT,1913160,1877750,2020-04-08 14:00:40 EDT,2020-04-08,14:00:40,Link,500,370,18,55,50,3,1,2,1,0,,-,0,0,0,N/A,https://www.facebook.com/healthyholisticliving/posts/3007299395979466,Love this!!! This is what we need!,https://www.healthy-holistic-living.com/north-carolina-will-require-high-school-students-to-take-personal-finance-course-to-graduate/?utm_source=HHL,,,North Carolina will require high school students to take personal finance course to graduate,"Hopefully, more states follow the lead of North Carolina and make personal finance a required course for graduation.",,,,2.99
Earthley,earthley,749122528556667,HEALTH & WELLNESS WEBSITE,US,"An all-natural alternative to your personal care and wellness needs! Soaps, salves, tinctures, and more!!!",2018-10-18 03:36:42 EDT,30177,31147,2020-04-08 13:51:02 EDT,2020-04-08,13:51:02,Link,270,7,59,78,0,44,1,4,77,0,,-,0,0,0,N/A,https://www.facebook.com/earthley/posts/1889965151139060,"Is this the level of control we want the government and the medical industry to have over our lives? ""By simply tapping the smart wristband with a smartphone, business operators and employers can instantly see whether a patron or employee is cleared for entry by a registered US physician who has vaccinated and/or tested the person for COVID-19 or its resultant antibodies."" https://buckrail.com/covid-19-public-alert-system-and-immunity-i-d-band-could-save-lives/",https://buckrail.com/covid-19-public-alert-system-and-immunity-i-d-band-could-save-lives/?fbclid=IwAR2HCKnYBhdUeAFjH944ak8NOPBZAq1Ny-RsivjBk0qimQfVn9DXrTVDd4g,,,"COVID-19 public alert system and immunity I.D. band could save lives - Buckrail - Jackson Hole, news","JACKSON, Wyo. – Lifekey has introduced a new technology that could help prevent the spread of COVID-19 in your community and help people get back to work and travel post-quarantine. “We have already built a secure, HIPAA compliant platform for you to store and share your personal medical data wh...",,,,-1.48
Children's Health Defense,ChildrensHealthDefense,1797590283821718,NONPROFIT ORGANIZATION,US,"End childhood health epidemics by exposing causes, eliminating harmful exposures; seeking justice for the injured and establishing safeguards.",2019-03-08 13:04:29 EST,103292,111690,2020-04-08 13:24:36 EDT,2020-04-08,13:24:36,Link,547,303,20,149,71,4,0,0,0,0,,-,0,0,0,N/A,https://www.facebook.com/ChildrensHealthDefense/posts/2604364083144330,"Children's Health Defense campaign to stop the 5G deployment during quarantine is making waves - over 50,000 letters were sent, mayors are talking about it and contacting their attorneys, and their attorneys are confirming that our solution is legally valid. Some municipalities got inspired to take action to stop the wireless industry aggression using our idea and by taking further action. With your help, we will continue to be solution-oriented and legally pro-active until we win. Click here to take action: https://childrenshealthdefense.org/child-health-topics/take-action/emergency-ordinance/chd-stop-5g-emergency-ordinance-campaign-is-making-waves-an-update-and-next-steps/",https://childrenshealthdefense.org/child-health-topics/take-action/emergency-ordinance/chd-stop-5g-emergency-ordinance-campaign-is-making-waves-an-update-and-next-steps/,,,CHD's Stop 5G Emergency Ordinance Campaign Is Making Waves - an Update and Next Steps • Children's Health Defense,"Thank you for taking action! Over 50,000 letters were sent to municipalities in the US asking them to pass an emergency ordinance to stop the deployment",,,,1.88
Circleofmamas,circleofmamas,1855831771359080,HEALTH & WELLNESS WEBSITE,US,"Our mission is to spread awareness of Vaccine Injuries. 

",2020-10-30 19:11:58 EDT,N/A,N/A,2020-04-08 13:21:51 EDT,2020-04-08,13:21:51,Photo,77,58,1,2,16,0,0,0,0,0,,-,0,0,0,N/A,https://www.facebook.com/circleofmamas/posts/2577598129182437,Thank you @johncusack for: A. Being one of my favorite actors & B. Not being just another sheep ✖️🐑 👏 #5g #asbestos #scienceisunsettling #wakeup #questions #environment #publichealth #risks #woke #sheep #asleep,https://www.facebook.com/circleofmamas/photos/a.1876263759315881/2577598129182437/?type=3,https://www.facebook.com/login/?next=https%3A%2F%2Fwww.facebook.com%2Fcircleofmamas%2Fphotos%2Fa.1876263759315881%2F2577598129182437%2F%3Ftype%3D3,John Cusack @johncusack Very instructive. Suggest a new broadly used tech may be harmful hysteria Um asbestos ? Anyone nuclear power- Fracking ? Your acting like fucking Sheep- It's basic not conspiracy 11:40 AM 4/7/20 Tweetbot for iOS 23 Retweets 182 Likes,Timeline Photos,,,,,4.05
Earthley,earthley,749122528556667,HEALTH & WELLNESS WEBSITE,US,"An all-natural alternative to your personal care and wellness needs! Soaps, salves, tinctures, and more!!!",2018-10-18 03:36:42 EDT,30177,31147,2020-04-08 13:04:05 EDT,2020-04-08,13:04:05,Link,6,4,0,0,2,0,0,0,0,0,,-,0,0,0,N/A,https://www.facebook.com/earthley/posts/1888969284571980,"Do you struggle with headaches? Many people do, and there are *tons* of different natural remedies for them. A lot of people try many of those remedies, only to find a lot don't work. Why is that? Is that natural really isn't all it's cracked up to be? The truth is, headaches have many different underlying causes. And if you choose the wrong remedy, it won't help! For example, if you're a little dehydrated, lavender essential oil won't fix that! That's why we created this new, free guide. It looks at the different types of headaches, common underlying reasons for them, and the best remedies for each. Grab the guide now --> https://www.earthley.com/product/a-guide-to-headaches/",https://www.earthley.com/product/a-guide-to-headaches/,,,A Guide to Headaches - Earthley,"Struggling with headaches?   Before you search for relief, you need to first determine why you have a headache. This is the key to finding the right natural remedy to address the root issue. This guide will help you to do just that. We will go over the four most common reasons for headaches and how...",,,,-66.5
Holistic Hilda,HolisticHilda,985921748210269,PODCAST,,Do you want to improve your health w/o fancy shakes or flashy programs? Holistic Hilda is an expert on ancestral health practices & she can show you how to nurture wellbeing the natural way.,2020-05-01 19:32:09 EDT,N/A,N/A,2020-04-08 12:49:13 EDT,2020-04-08,12:49:13,Native Video,5,5,0,0,0,0,0,0,0,0,owned,Yes,99,99,0,00:00:15,https://www.facebook.com/HolisticHilda/posts/1815826618553107,Just a few friendly tips for thriving in this toxic world! 😘,https://www.facebook.com/HolisticHilda/videos/235855091114492/,,,,,,,,-0.58
Healthy Holistic Living,healthyholisticliving,134953239880777,HEALTH & WELLNESS WEBSITE,US,"""The greatest discovery of any generation is that human beings can alter their lives by altering the attitudes of their minds.""            ",2014-04-16 16:05:04 EDT,1913160,1877750,2020-04-08 12:00:01 EDT,2020-04-08,12:00:01,Link,598,344,43,94,110,1,1,4,1,0,,-,0,0,0,N/A,https://www.facebook.com/healthyholisticliving/posts/3009859812390091,39 tigers and 3 bears rescued from Joe Exotic's zoo in Oklahoma are now living at the Wild Animal Sanctuary in Keenesburg. Their habitats are significantly larger and they never have to pose for any pictures with guests.,https://www.healthy-holistic-living.com/42-animals-rescued-from-tiger-king-zoo-in-oklahoma-now-at-sanctuary-in-colorado/?utm_source=HHL,,,42 animals rescued from ‘Tiger King’ zoo in Oklahoma now at sanctuary in Colorado,"Joe Exotic was sentenced to 22 years in prison for seventeen counts of animal abuse, and two of murder-for-hire.",,,,3.58
Healthy Holistic Living,healthyholisticliving,134953239880777,HEALTH & WELLNESS WEBSITE,US,"""The greatest discovery of any generation is that human beings can alter their lives by altering the attitudes of their minds.""            ",2014-04-16 16:05:04 EDT,1913160,1877750,2020-04-08 10:01:01 EDT,2020-04-08,10:01:01,Photo,"1,755",446,64,529,17,8,690,1,0,0,,-,0,0,0,N/A,https://www.facebook.com/healthyholisticliving/posts/3011169762259096,March...,https://www.facebook.com/healthyholisticliving/photos/a.327445603964872/3011169762259096/?type=3,,Can't believe I've lived in 6 different decades: 1980s 1990s 2000s 2010s 2020s March,Timeline Photos,,,,,1.18
Healthy Holistic Living,healthyholisticliving,134953239880777,HEALTH & WELLNESS WEBSITE,US,"""The greatest discovery of any generation is that human beings can alter their lives by altering the attitudes of their minds.""            ",2014-04-16 16:05:04 EDT,1913160,1877750,2020-04-08 09:00:22 EDT,2020-04-08,09:00:22,Link,42,15,2,12,0,1,0,12,0,0,,-,0,0,0,N/A,https://www.facebook.com/healthyholisticliving/posts/3007298832646189,"""The cough and fever weren't nearly as difficult as calling everyone I'd crossed paths with to tell them I might have infected them.""",https://www.healthy-holistic-living.com/im-a-42-year-old-woman-who-got-the-new-coronavirus-this-is-what-its-been-like/?utm_source=HHL,,,I'm A 42-Year-Old Woman Who Got The New Coronavirus. This Is What It's Been Like.',Reducing the stigma around COVID-19 will allow people to be honest about their experiences and get the treatment they need.,,,,-3.98
Earthley,earthley,749122528556667,HEALTH & WELLNESS WEBSITE,US,"An all-natural alternative to your personal care and wellness needs! Soaps, salves, tinctures, and more!!!",2018-10-18 03:36:42 EDT,30177,31147,2020-04-08 08:46:00 EDT,2020-04-08,08:46:00,Photo,87,55,3,16,13,0,0,0,0,0,,-,0,0,0,N/A,https://www.facebook.com/earthley/posts/1885126391622936,"A lot of posts about saving money say things like ""just stop eating out"" or ""cancel that expensive gym membership!"" But we're way past that, and the people who truly need to save money already aren't doing those things. These are 10 tips we use to save money on real food that really work -- and will help stretch food at a time when many of us really need to do that! Learn more --> https://modernalternativemama.com/2012/06/22/10-tips-for-saving-money-on-real-food/",https://www.facebook.com/earthley/photos/a.749202208548699/1885125514956357/?type=3,,,,,,,,-7.84
Melissa Malinowski Naturopath Practitioner,IntegrativeNutritionalTherapies,276177918209,HEALTH & WELLNESS WEBSITE,US,"Melissa Malinowski focuses on intentional living and creating a healthy home. She implements bioscan assessments across the US to uncover fundamental root imbalances for people & pets, to help them live their best lives.",2020-01-30 20:57:48 EST,5148,5239,2020-04-08 08:23:04 EDT,2020-04-08,08:23:04,Photo,348,85,53,129,3,32,0,2,44,0,,-,0,0,0,N/A,https://www.facebook.com/IntegrativeNutritionalTherapies/posts/10158228248768210,"What kind of Fauci slip was this? ""I hope we don't have so many people infected that we actually have that herd immunity!"" Fauci clearly states that he doesn't want too many people infected (natural infection) where we then reach HERD IMMUNITY. Then no va((ine needed and no huge profits made. Where they always claim that herd immunity is reached through being va((inated. We've been trying to explain the real NATURAL herd immunity for how long now? We definitely do NOT need a va((ine anyway. Why lower the immune system further by injecting aborted fetal cells, horse serum, mercury, aluminum, glyphosate, retroviruses, calf blood and the actual VIRUS itself? Watch the clip ➜ https://www.c-span.org/video/standalone/?c4866591/user-clip-dr-fauci-hoping-infected-actual-herd-immunity P.S. Fauci's job pays just a tiny bit less than the Office of the President. He's been in that position for over 30 years, while taking patent royalties in addition to high-paying seats private sector boards. He runs a constant quid-pro-quo with his pharma buddies to create public-private partnerships that are 100% funded by billions of taxpayer dollars, and he has produced ALMOST NOTHING for it. He's ""worked"" on an AIDS va((ine for 30 years! P.S.S. This whole COVID thing is a total power grab by the globalists and ELITES for complete control and depopulation, and it's already on record that this is their plan - little by little, step by step, Bill Gates and Dr. Fauci are trying to run the show, claiming no one is safe until they are locked in their homes and have mandatory va((ines or can prove an antibody, of course, not true at all, but most people will buy it - as they are now. And when they crash our economy, stop the postal service, create a cashless society, make you have apps on your phone to track you, mandate microchipping with your ""immunity certificate and mandated va((ines"" and now claim animals can get and transmit COVID-19, to control our food supply - they will have that much more control over us.",https://www.facebook.com/IntegrativeNutritionalTherapies/photos/a.279265483209/10158228235213210/?type=3,,,,,,,,3.74
Healthy Holistic Living,healthyholisticliving,134953239880777,HEALTH & WELLNESS WEBSITE,US,"""The greatest discovery of any generation is that human beings can alter their lives by altering the attitudes of their minds.""            ",2014-04-16 16:05:04 EDT,1913160,1877750,2020-04-08 07:00:18 EDT,2020-04-08,07:00:18,Photo,750,459,17,196,77,1,0,0,0,0,,-,0,0,0,N/A,https://www.facebook.com/healthyholisticliving/posts/3010854425623963,Outreach Director at Pious Projects,https://www.facebook.com/VegetableJuicing/photos/a.181515575236990/1077836912271514/?type=3,,"IF THEY RESPECT YOU, RESPECT THEM. IF THEY DISRESPECT YOU, STILL RESPECT THEM. DO NOT ALLOW THE ACTIONS OF OTHERS TO DECREASE YOUR GOOD MANNERS, BECAUSE YOU REPRESENT YOURSELF NOT OTHERS. MOHAMMED ZEYARA FitLife .tv",Juicing Vegetables,,,,,-1.98
Healthy Holistic Living,healthyholisticliving,134953239880777,HEALTH & WELLNESS WEBSITE,US,"""The greatest discovery of any generation is that human beings can alter their lives by altering the attitudes of their minds.""            ",2014-04-16 16:05:04 EDT,1913160,1877750,2020-04-08 06:00:04 EDT,2020-04-08,06:00:04,Link,523,234,8,234,39,8,0,0,0,0,,-,0,0,0,N/A,https://www.facebook.com/healthyholisticliving/posts/2984145184961554,,https://kottke.org/20/01/paris-museums-put-100000-images-online-for-unrestricted-public-use?fbclid=IwAR2Qbs7Yk5ciYEdzo6iYsKYZN7xJvxbRKAgrMy5J8ccXQFTlnQkFp-AaIY8,,,"Paris Museums Put 100,000 Images Online for Unrestricted Public Use","Paris Musées, a collection of 14 museums in Paris have recently made high-res digital copies of 100,000 artwo",,,,3.13
Healthy Holistic Living,healthyholisticliving,134953239880777,HEALTH & WELLNESS WEBSITE,US,"""The greatest discovery of any generation is that human beings can alter their lives by altering the attitudes of their minds.""            ",2014-04-16 16:05:04 EDT,1913160,1877750,2020-04-08 05:00:04 EDT,2020-04-08,05:00:04,Photo,857,184,27,409,6,0,230,1,0,0,,-,0,0,0,N/A,https://www.facebook.com/healthyholisticliving/posts/3010682162307856,It's just day and night now.,https://www.facebook.com/healthyholisticliving/photos/a.327445603964872/3010682162307856/?type=3,,"For those who have lost track, today is Blursday the fortyteenth of Maprilay.",Timeline Photos,,,,,-1.74
Healthy Holistic Living,healthyholisticliving,134953239880777,HEALTH & WELLNESS WEBSITE,US,"""The greatest discovery of any generation is that human beings can alter their lives by altering the attitudes of their minds.""            ",2014-04-16 16:05:04 EDT,1913160,1877750,2020-04-08 03:00:02 EDT,2020-04-08,03:00:02,Photo,126,79,5,24,17,1,0,0,0,0,,-,0,0,0,N/A,https://www.facebook.com/healthyholisticliving/posts/3010528628989876,Some people dream of success,https://www.facebook.com/AskDrNandi/photos/a.312022975485597/3000711349950066/?type=3,,"Some people dream of success, while other people get up every morning and make it happen. WAYNE HUIZENGA DR.NANDI ASKDRNANDI.COM","Partha Nandi, MD","Some people dream of success, while other people get up every morning and make it happen. - Wayne Huizenga
#AskDrNandi #HealthHero #DetroitDoc #AmericasDoc  #ParthaNandiMD #Namaste #Healthy  #Life #quoteoftheday #treasures!! #Health #Inspiration #Quote #GoodReads #DailyReminder #KeyToSuccess #BeHappy  #Listen #Wellness #Laugh #Appreciate #Learn #LoveYourself #BeYourOwnHealthHero  #FoodIsMedicine  #RealTalk #KeyToSuccess #Motivation #Inspiration #Happiness  #healthywords #DrNandiShow",,,,-11.8
Healthy Holistic Living,healthyholisticliving,134953239880777,HEALTH & WELLNESS WEBSITE,US,"""The greatest discovery of any generation is that human beings can alter their lives by altering the attitudes of their minds.""            ",2014-04-16 16:05:04 EDT,1913160,1877750,2020-04-08 02:00:18 EDT,2020-04-08,02:00:18,Photo,"2,937",1462,76,954,118,11,2,309,5,0,,-,0,0,0,N/A,https://www.facebook.com/healthyholisticliving/posts/3010451172330955,We're all just people in the end.,https://www.facebook.com/VegetableJuicing/photos/a.181515575236990/1077836112271594/?type=3,,,Juicing Vegetables,,,,,1.98
Healthy Holistic Living,healthyholisticliving,134953239880777,HEALTH & WELLNESS WEBSITE,US,"""The greatest discovery of any generation is that human beings can alter their lives by altering the attitudes of their minds.""            ",2014-04-16 16:05:04 EDT,1913160,1877750,2020-04-08 00:00:11 EDT,2020-04-08,00:00:11,Link,65,28,7,17,12,0,0,1,0,0,,-,0,0,0,N/A,https://www.facebook.com/healthyholisticliving/posts/3009457879096951,"If it’s been a while since you called a loved one, now is a great time to reach out and let them know the small ways they have touched your life and maybe ask a question or two.",https://expand-your-consciousness.com/questions-for-a-loved-one-before-its-too-late/,,,Questions for a Loved One Before It’s Too Late,It’s only after a loved one has passed away that we realize all the questions we wished we would have asked.,,,,-2.57
Healthy Holistic Living,healthyholisticliving,134953239880777,HEALTH & WELLNESS WEBSITE,US,"""The greatest discovery of any generation is that human beings can alter their lives by altering the attitudes of their minds.""            ",2014-04-16 16:05:04 EDT,1913160,1877750,2020-04-07 23:00:06 EDT,2020-04-08,23:00:06,Photo,"3,012",2124,75,479,327,3,3,1,0,0,,-,0,0,0,N/A,https://www.facebook.com/healthyholisticliving/posts/3010208895688516,And I don't mean meat subsidies,https://www.facebook.com/VegetableJuicing/photos/a.181515575236990/1075541645834374/?type=3,,,Juicing Vegetables,,,,,2.03
Healthy Holistic Living,healthyholisticliving,134953239880777,HEALTH & WELLNESS WEBSITE,US,"""The greatest discovery of any generation is that human beings can alter their lives by altering the attitudes of their minds.""            ",2014-04-16 16:05:04 EDT,1913150,1877717,2020-04-07 20:42:47 EDT,2020-04-08,20:42:47,Link,129,51,4,68,6,0,0,0,0,0,,-,0,0,0,N/A,https://www.facebook.com/healthyholisticliving/posts/3010008115708594,Draining your lymph nodes will literally change your life.,https://www.healthy-holistic-living.com/one-technique-will-unclog-lymph-glands-no-time/,,,Do This One Technique Before Bedtime To Help Drain Your Lymph Glands,"Article originally published on Living Traditionally republished with permission.  The truth is, most people have never heard of lymphatic drainage or even the lymphatic system. This is because it is not often talked about, however, in 2012 researchers at USC made this statement: “… the lymphat...",,,,-1.29
Earthley,earthley,749122528556667,HEALTH & WELLNESS WEBSITE,US,"An all-natural alternative to your personal care and wellness needs! Soaps, salves, tinctures, and more!!!",2018-10-18 03:36:42 EDT,30138,31103,2020-04-07 20:10:00 EDT,2020-04-08,20:10:00,Photo,487,210,95,115,11,47,0,6,3,0,,-,0,0,0,N/A,https://www.facebook.com/earthley/posts/1888420637960178,"As recently as a few days ago, they were predicting that coronavirus in Ohio would peak late April to mid-May, with 10,000 new cases per day at that peak. This was supposed to justify all of the shut-downs, which have cost tens of thousand jobs (Ohio is the #2 state for unemployment right now). The previous projections, if we ""did nothing"" were 62,000 cases per day, peaking on Mar. 22. On that date, we had around 250 new cases, even though the beginnings of ""social distancing"" and school closings had taken place only a week prior -- not long enough to have had any kind of serious impact. (And we're supposed to believe that it reduced cases by 28,400%.) Monday, after getting ""massive amounts of new data"" they revised their projections. They're expecting it to peak TOMORROW. With around 400 new cases per day. They expect to have plenty of resources to handle this. Ohio isn't the only state coming out with new models. Many states are revising their case and death rates down...by exponential amounts. Instead of tens of thousands dead...they're thinking maybe a couple hundred (per state). Their reaction to this? ""Oops, we didn't know."" No restrictions have been lifted. Some states have clamped down further very recently. Some, like California, literally have police everywhere, pulling people over for trying to drive to the store or for not wearing a mask. How can we ever trust them again, if they overreacted THIS massively? The graph below is the actual number of new cases per day in Ohio, vs. the projected new cases. Each day, the difference between the numbers grows...because we're looking at a linear curve when they were expecting an exponential one. Put simply, they were just wrong. They were absolutely wrong. What do you think should happen next? How should we hold our elected officials accountable for this?",https://www.facebook.com/earthley/photos/a.749202208548699/1888415037960738/?type=3,,,,,,,,-1.4
Holistic Hilda,HolisticHilda,985921748210269,PODCAST,,Do you want to improve your health w/o fancy shakes or flashy programs? Holistic Hilda is an expert on ancestral health practices & she can show you how to nurture wellbeing the natural way.,2020-05-01 19:32:09 EDT,N/A,N/A,2020-04-07 18:45:42 EDT,2020-04-07,18:45:42,Photo,27,14,4,1,8,0,0,0,0,0,,-,0,0,0,N/A,https://www.facebook.com/HolisticHilda/posts/1815108838624885,"It feels like we’re in the middle of some YA dystopian novel, right? People are sick and dying. Quarantine & lock-down orders are in effect worldwide. Many have lost their jobs. Health care and other “essential” workers are on the front lines, risking their own health for the sake of others. Officials are making decisions that some support & others question. Media reports increase the sense of fear & trepidation among the populace. How long the crisis will last is unclear. The question for me (and for each of us really) is a simple one: how then will we live? What will my role be in this story? I could be a mercenary, preying on the vulnerable. I could be an extra—in one scene & gone the next. I could be a character who is just looking out for their own needs. But if I had to pick, I’d want to be a heroine. Not necessarily the one at the center of the story. ☺️ But one who is definitely on the right side—pulling for the sick, the discouraged. One who reaches out & makes a difference in one of the darkest moments of her time. One that does her best to act rightly, love mercy, and to walk humbly. I said “If I had to pick...” and, guess what, I DO get to pick. I will not at this time share all that I’m doing behind the scenes but I will tell you this: I will continue to communicate, to the best of my ability, clear, helpful information that you may live your best, healthiest life. 🤗 So now I pose the question to you: how then will YOU live? 🤔 P.S. This post is a snippet of a convo I had w/ a friend today. 🧡 P.P.S. Grab my “Get healthier w/o dieting” free pdf from my website holistichilda.com (link in bio). These tips are applicable anytime & are particularly pertinent today!",https://www.facebook.com/HolisticHilda/photos/a.1002953586507085/1815108838624885/?type=3,,,Timeline Photos,,,,,-1.3
